{
  "capture_bytes": 8810,
  "capture_sha256": "a27125ff1141a62b8294f055018e9d4f159d1bb2018d1dfb99a75c36a54042d6",
  "environment": "native",
  "evidence_class": "local-framed-unsealed",
  "observation_schema": "M15O3",
  "power_supply_contract": "usb-or-usb-pd-v1",
  "schema": "M15-context-v2",
  "sealed_baseline": false,
  "topology": {
    "cable_inventory_sha256": "2222222222222222222222222222222222222222222222222222222222222222",
    "charger_inventory_sha256": "1111111111111111111111111111111111111111111111111111111111111111",
    "evidence_path": "direct-usb",
    "instrumentation_inventory_sha256": "3333333333333333333333333333333333333333333333333333333333333333",
    "observation_schema": "M15O3",
    "power_source": "pc-usb",
    "power_supply_contract": "usb-or-usb-pd-v1",
    "schema": "M15-topology-v2"
  },
  "topology_sha256": "213646319a1f9714cf61aa391594e700fa6d6cf347fbaca684dc0907e4d58c62"
}
